{
  "$schema": "./schema.json",
  "schemaVersion": 1,
  "name": "Daily Sanity Test",
  "slug": "daily-sanity-test",
  "owner": "Digital First",
  "projectPath": "VAA.EAPI.Automation/VAA.EAPI.Automation.SearchAndBook.UI/VAA.EAPI.Automation.SearchAndBook.UI.csproj",
  "categories": [
    "DailySanity-RevenueBooking"
  ],
  "summaryConfigPath": "config/regression-summary/default/default-summary.json",
  "timeoutMinutes": 120,
  "runnerLabels": [
    "self-hosted",
    "Windows",
    "eapi-automation"
  ],
  "requiredVariables": [
    "SAB_BASE_URL"
  ],
  "requiredSecrets": [
    "BROWSERSTACK_USERNAME",
    "BROWSERSTACK_ACCESS_KEY",
    "TEAMS_DAILY_SANITY_TEST_WEBHOOK",
    "SLACK_WEBHOOK_URL"
  ]
}
